{
  "historia_vida": "Maria mudou-se para São Gonçalo há 6 anos buscando oportunidades de trabalho e apoio familiar. Passou por situações de violência doméstica e reconstruiu sua rede de apoio junto a vizinhas e coletivos locais.",
  "rede_apoio": "Conta com apoio da mãe, da vizinha Dona Ana e do coletivo de artesãs do bairro.",
  "contexto_atual": "Atualmente atua como artesã autônoma, com renda variável. Mora em casa alugada com o filho adolescente e a mãe idosa.",
  "avaliacao_tecnica": "Identifica-se potencial para fortalecimento da autonomia financeira, necessidade de suporte psicológico contínuo e acompanhamento da saúde da mãe.",
  "encaminhamento": {
    "projeto": "Projeto Gastronomia Social",
    "data": "2024-07-25",
    "responsavel": "Carla Souza",
    "assinatura": "Carla Souza"
  },
  "anexos": ["https://imm.local/anexos/visao-holistica-2024-07.pdf"]
}
